{
  "format_version": "0.2",
  "name": "zhuziqing",
  "display_name": "朱自清",
  "language": "zh-CN",
  "genres": [
    "narrative",
    "literary",
    "essay"
  ],
  "version": "0.4.2",
  "created": "2026-09-28",
  "updated": "2026-10-05",
  "corpus": {
    "works": [
      "背影",
      "春",
      "荷塘月色",
      "匆匆",
      "桨声灯影里的秦淮河",
      "绿",
      "白种人——上帝的骄子",
      "儿女",
      "冬天",
      "南京"
    ],
    "total_chars": 21355,
    "sampling": "全量（10 篇全文逐字统计，无抽样）",
    "confidence": "中高：10 篇散文全量（2.1 万字），覆盖抒情/纪游/家庭自省/时事关遇四路；4 篇时代的\"弱禁用\"结论已逐条重裁决（thought.md r2）"
  },
  "provenance": [
    {
      "type": "web",
      "url": "http://ccview.net/htm/xiandai/zzq/zzqsw002.htm",
      "fetched_at": "2026-09-28",
      "notes": "荷塘月色 / 背影 / 匆匆 三篇来源 ccview.net（GB2312→UTF-8，文字贴近 1925/1927 初版用语）；首选维基文库在本网络环境不可达。"
    },
    {
      "type": "web",
      "url": "https://github.com/BlueSky-07/Zi/blob/master/public/articles/chun-zhuziqing.txt",
      "fetched_at": "2026-09-28",
      "notes": "《春》来源公开教材文本仓库，与通行本交叉验证确认完整（原文约 750 字，非残缺）。"
    }
  ],
  "license_note": "公版作者（1948 年逝世）。exemplars 为公版原文短引（每条 ≤200 字）加批注；本包不含任何全文。",
  "changelog": [
    {
      "version": "0.1.0",
      "date": "2026-09-28",
      "changes": "初版：4 篇全文（4063 字）统计指纹 + 全文精读蒸馏 + 人工校订档案；10 项带容差指标。"
    },
    {
      "version": "0.2.0",
      "date": "2026-09-29",
      "changes": "分层指纹：genres（narrative/essay 阈值树 + Delta 档案）+ self_check 层内真迹留一及格线；校准点入 evals Case F"
    },
    {
      "version": "0.3.0",
      "date": "2026-09-30",
      "changes": "thought.md 思想层（v0.3）：六节蒸馏（置信度逐节标注，语料仅 4 篇，回避/禁区为弱禁用）+ motif 词表 10 词与 motif_stats；经用户逐节校订定稿（2026-09-30，全按草案）"
    },
    {
      "version": "0.3.1",
      "date": "2026-10-05",
      "changes": "分层指纹重建"
    },
    {
      "version": "0.4.0",
      "date": "2026-10-05",
      "changes": "Case G 收官：语料 4→10 篇（维基文库，公版，逐篇 provenance；繁→简 opencc + 语境核查）；essay 层留一线 2.112→1.486（n=10）；跨包归因仪器修正为度量空间+全局基准（13/15，p=0.004，zhuziqing 侧 9/10）——旧字频口径的 7/9 判定为仪器伪影如实撤销；thought.md r2 重蒸馏（2 条弱禁用被推翻、motif 词表 12 词重算）"
    },
    {
      "version": "0.4.1",
      "date": "2026-10-05",
      "changes": "motif_stats 更新（motif_count.py）"
    },
    {
      "version": "0.4.2",
      "date": "2026-10-05",
      "changes": "motif_stats 更新（motif_count.py）"
    }
  ],
  "thought": true
}
